### ISSUE TITLE
Reconnect to broker

### ISSUE THREAD

**Issue by Artimi** [aio-libs/aiokafka#144]
Hi,
we are having a few network interruption lately and so I'm digging in reconnecting. I was not able to find reconnect feature in `aiokafka` in `conn.py` nor in `client.py`. Is it implented in `aiokafka` elsewhere or is it missing? 
I was looking in the kafka documentation and there is an option `reconnect.backoff.ms` for consumer and producer (https://kafka.apache.org/0102/documentation/#newconsumerconfigs) that prevents too fast reconnecting in case of failure. In `kafka-python` it is implemented in `KafkaClient._maybe_refresh_metadata` and another part in `KafkaClient._boostrap`.

I was trying to drop connection using [tcpkill](https://en.wikipedia.org/wiki/Tcpkill) and I discovered that it blocks connection from rising sequence of ports 
```
10.107.20.205:39614 > 172.17.0.2:9092: R 2713530037:2713530037(0) win 0
...
10.107.20.205:39616 > 172.17.0.2:9092: R 3723147408:3723147408(0) win 0
...
10.107.20.205:39618 > 172.17.0.2:9092: R 830983828:830983828(0) win 0
```
Do you have an idea how can this happen? Is there some reconnect after all? However when I stopped `tcpkill` no new messages went through although in `kafka-python` it reconnected and started to accepting messages again.

I'm willing to implement this feature but I would welcome any advice where it would be best to put (I was thinking about putting it in `conn.py` in case of some error in sending message).

**Comment by Drizzt1991** [comment]
Hey there, that's new, it should just reconnect. How you actually reproduce this?

To answer your question of where it reconnects:
* https://github.com/aio-libs/aiokafka/blob/master/aiokafka/client.py#L309 - here we check if our connection is still `.connected()`, if not we reconnect.
* https://github.com/aio-libs/aiokafka/blob/master/aiokafka/conn.py#L180 - Here's where the connection actually notices that it's disconnected.

**Comment by Artimi** [comment]
Ah, I'm sorry for wrong conclusion. It wasn't working for me because I didn't catch exceptions from `get()` and `commit()`. It seems that `aiokafka` is working flawlessly. Only thing that confused me is missing `reconnect.backoff.ms`. I was searching for that in the codebase and didn't find it so I concluded that `aiokafka` is not reconnecting. Sorry for my mistake and thanks for your response.

**Comment by Drizzt1991** [comment]
@Artimi NP). Glad it was resolved.
Somehow we end up using `retry_backoff_ms` for both reconnect and error backoff. Don't know if that's a big issue yet.

**Comment by Artimi** [comment]
I'm having another issue where I would expect client to reconnect. Sometimes the connection is in a weird state that I cannot get any answer from the node therefore I get `KafkaTimeoutError`. This results to endless heatbeat loop because coordinator calls `GroupCoordinator.ensure_coordinator_known` and it fails  in sending request. This repeats every 40,1 s because of timeout in `AIOKafkaConnection._request_timeout_ms == 40000` and `GroupCoordinator._retry_backoff_ms == 10000`. It seems that `AIOKafkaConnection.connected()` still holds true because it does not delete connection in `Client.send()` (from `ready` from `_get_conn`).
I think that on `KafkaTimeoutError` client should reconnect because this way it just disconnects and we have to restart the service. After restart everything runs smoothly until `KafkaTimeoutError` appears again.

Here I present excerpt of our logs:
```
March 28th 2017, 19:17:04.985    Error sending GroupCoordinatorRequest_v0 to node 0 [KafkaTimeoutError] -- marking coordinator dead
March 28th 2017, 19:17:04.986    Group Coordinator Request failed: KafkaTimeoutError
March 28th 2017, 19:17:45.088    Error sending GroupCoordinatorRequest_v0 to node 0 [KafkaTimeoutError] -- marking coordinator dead
March 28th 2017, 19:17:45.088    Group Coordinator Request failed: KafkaTimeoutError
```

**Comment by Drizzt1991** [comment]
Could you provide full configuration for the consumer?

**Comment by Artimi** [comment]
Sure:
```
self._consumer = aiokafka.AIOKafkaConsumer(
	loop = loop,
	bootstrap_servers = hosts,
	group_id = consumer_group,
	enable_auto_commit = False,
	auto_offset_reset = 'earliest',
	heartbeat_interval_ms = 3 * 1000,
	metadata_max_age_ms = 30 * 1000,
)

```

**Comment by Drizzt1991** [comment]
Then where did you get `GroupCoordinator._retry_backoff_ms == 10000`?

**Comment by Artimi** [comment]
You are right, sorry it should be 100 as the default value is. I edited the comment.

**Comment by Drizzt1991** [comment]
So to sum it up, there is a case where Kafka can still have the socket in open state, but requests timeout. That's weird, but probably possible. So the fix should be to discard connections, that have timeouts.

**Comment by Artimi** [comment]
Yes, exactly. Just delete the connection if it has timeout and reconnect again. This should do no harm, right?

**Comment by Artimi** [comment]
Hey @Drizzt1991 thanks for merge. I just wanted to ask when do you plan next release?

**Comment by Drizzt1991** [comment]
@Artimi Great thanks for submitting issues, really helps. Release will be this week, probably on weekend.

**Comment by Drizzt1991** [comment]
@Artimi The release is in progress. It should be OK as of 0.2.2.
